{
  "$schema": "../schema/alias.schema.json",
  "provider": "antigravity",
  "description": "Antigravity 中转服务的模型别名映射",
  "aliases": {
    "gemini-3-pro-preview": {
      "actual": "gemini-3-pro-high",
      "internal_name": "gemini-3-pro-high",
      "provider": "google",
      "description": "Gemini 3 Pro 预览版"
    },
    "gemini-3-pro-image-preview": {
      "actual": "gemini-3-pro-image",
      "internal_name": "gemini-3-pro-image",
      "provider": "google",
      "description": "Gemini 3 Pro 图像版"
    },
    "gemini-3-flash-preview": {
      "actual": "gemini-3-flash",
      "internal_name": "gemini-3-flash",
      "provider": "google",
      "description": "Gemini 3 Flash 预览版"
    },
    "gemini-2.5-flash": {
      "actual": "gemini-2.5-flash",
      "internal_name": "gemini-2.5-flash",
      "provider": "google",
      "description": "Gemini 2.5 Flash"
    },
    "gemini-2.5-computer-use-preview-10-2025": {
      "actual": "gemini-2.5-computer-use",
      "internal_name": "rev19-uic3-1p",
      "provider": "google",
      "description": "Gemini 2.5 Computer Use 预览版"
    },
    "gemini-claude-sonnet-4-5": {
      "actual": "claude-sonnet-4-5-20250929",
      "internal_name": "claude-sonnet-4-5",
      "provider": "anthropic",
      "description": "通过 Antigravity 访问的 Claude Sonnet 4.5"
    },
    "gemini-claude-sonnet-4-5-thinking": {
      "actual": "claude-sonnet-4-5-20250929",
      "internal_name": "claude-sonnet-4-5-thinking",
      "provider": "anthropic",
      "description": "Claude Sonnet 4.5 思考模式"
    },
    "gemini-claude-opus-4-5-thinking": {
      "actual": "claude-opus-4-5-20251101",
      "internal_name": "claude-opus-4-5-thinking",
      "provider": "anthropic",
      "description": "Claude Opus 4.5 思考模式"
    }
  },
  "updated_at": "2025-01-06T00:00:00Z"
}
